{
  "facts_version": "1.0.0",
  "analyzer": {
    "name": "deadset-go",
    "version": "2.0.0"
  },
  "language": "go",
  "evaluated": true,
  "generated": [
    {
      "path": "gen/go/v1/service.pb.go",
      "line": 1,
      "evidence": "header",
      "detail": "// Code generated by protoc-gen-go. DO NOT EDIT.",
      "generator": {
        "row": "protoc-gen-go-1",
        "version": "v1.36.11"
      },
      "schema_files": [
        "v1/service.proto"
      ]
    },
    {
      "path": "gen/go/v1/v1connect/service.connect.go",
      "line": 1,
      "evidence": "header",
      "detail": "// Code generated by protoc-gen-connect-go. DO NOT EDIT.",
      "generator": {
        "row": "protoc-gen-connect-go-1"
      },
      "schema_files": [
        "v1/service.proto"
      ]
    },
    {
      "path": "internal/mocks/mock.go",
      "line": 1,
      "evidence": "header",
      "detail": "// Code generated by MockGen. DO NOT EDIT."
    }
  ],
  "bindings": [
    {
      "role": "consumer",
      "symbol": "go://example.com/app/gen/go/v1#PingRequest.Number",
      "schema_file": "v1/service.proto",
      "schema": "proto://v1#PingRequest.number",
      "generated_file": "gen/go/v1/service.pb.go",
      "state": "live",
      "via": [
        "go://example.com/app/internal/api#Server.Ping"
      ]
    },
    {
      "role": "consumer",
      "symbol": "go://example.com/app/gen/go/v1/v1connect#PingServiceClient.Ping",
      "schema_file": "v1/service.proto",
      "schema": "proto://v1#PingService.Ping",
      "generated_file": "gen/go/v1/v1connect/service.connect.go",
      "state": "live"
    },
    {
      "role": "implementer",
      "symbol": "go://example.com/app/internal/api#Server.Ping",
      "schema_file": "v1/service.proto",
      "schema": "proto://v1#PingService.Ping",
      "state": "dead",
      "finding": {
        "code": "DS1802",
        "kind": "unread-schema-field",
        "language": "go",
        "position": {
          "path": "internal/api/server.go",
          "line": 21,
          "column": 18,
          "end_line": 27
        },
        "symbol": {
          "ref": "go://example.com/app/internal/api#Server.Ping",
          "kind": "method",
          "name": "(*Server).Ping",
          "parent": "go://example.com/app/internal/api#Server",
          "exported": true,
          "size_lines": 7,
          "objectpath": "Server.M0"
        },
        "reachability_class": "probable",
        "confidence": "probable",
        "liveness_relation": "reference-counting",
        "test_only": false,
        "generated": false,
        "component": {
          "id": "deadset-go/c-12",
          "root": true,
          "symbol_count": 1,
          "deletable_lines": 7
        },
        "retained_by": [],
        "configurations": [
          "linux-amd64"
        ],
        "consumers_loaded": [],
        "fixability": "manual",
        "severity": "deny",
        "message": "exported method has no reference in the target and none from any loaded consumer",
        "details": {}
      }
    }
  ]
}
