{
  "facts_version": "1.0.0",
  "analyzer": {
    "name": "deadset-ts",
    "version": "2.0.0"
  },
  "language": "ts",
  "evaluated": false,
  "generated": [
    {
      "path": "src/gen/v1/service_pb.ts",
      "line": 1,
      "evidence": "tag",
      "detail": "// @generated by protoc-gen-es v2.12.0 with parameter \"target=ts\"",
      "generator": {
        "row": "protoc-gen-es-2",
        "version": "v2.12.0"
      },
      "schema_files": ["v1/service.proto"]
    },
    {
      "path": "src/gen/v1/types.ts",
      "line": 1,
      "evidence": "header",
      "detail": "// Code generated by protoc-gen-ts_proto. DO NOT EDIT.",
      "generator": {
        "row": "ts-proto-2-types",
        "version": "v2.11.4"
      },
      "schema_files": ["v1/types.proto"]
    }
  ],
  "bindings": [
    {
      "role": "consumer",
      "symbol": "ts://@example/web/src/gen/v1/service_pb.ts#PingRequest.number",
      "schema_file": "v1/service.proto",
      "schema": "proto://v1#PingRequest.number",
      "generated_file": "src/gen/v1/service_pb.ts"
    },
    {
      "role": "consumer",
      "symbol": "ts://@example/web/src/gen/v1/service_pb.ts#PingService.ping",
      "schema_file": "v1/service.proto",
      "schema": "proto://v1#PingService.Ping",
      "generated_file": "src/gen/v1/service_pb.ts"
    },
    {
      "role": "fallback",
      "symbol": "ts://@example/web/src/gen/v1/types.ts#Ping",
      "schema_file": "v1/types.proto",
      "generated_file": "src/gen/v1/types.ts",
      "scope": "types",
      "state": "live"
    }
  ]
}
