{
  "facts_version": "1.0.0",
  "analyzer": {
    "name": "deadset-proto",
    "version": "2.0.0"
  },
  "language": "proto",
  "evaluated": true,
  "generated": [],
  "bindings": [
    {
      "role": "schema",
      "symbol": "proto://v1#Ping",
      "schema_file": "a/v1/service.proto",
      "schema": "proto://v1#Ping",
      "state": "dead",
      "finding": {
        "code": "DS1801",
        "kind": "unused-schema-type",
        "language": "proto",
        "position": {
          "path": "proto/a/v1/service.proto",
          "line": 5,
          "column": 3,
          "end_line": 5
        },
        "symbol": {
          "ref": "proto://v1#Ping",
          "kind": "message",
          "name": "Ping",
          "parent": "proto://v1#",
          "exported": true,
          "size_lines": 1
        },
        "reachability_class": "probable",
        "confidence": "probable",
        "liveness_relation": "reference-counting",
        "test_only": false,
        "generated": false,
        "component": {
          "id": "deadset-proto/c-1",
          "root": true,
          "symbol_count": 1,
          "deletable_lines": 1
        },
        "retained_by": [],
        "configurations": [],
        "consumers_loaded": [],
        "fixability": "deletable",
        "severity": "deny",
        "message": "schema type is used by no binding in any analyzed language",
        "details": {}
      },
      "uses": [],
      "members": []
    },
    {
      "role": "schema",
      "symbol": "proto://v1#Ping",
      "schema_file": "b/v1/service.proto",
      "schema": "proto://v1#Ping",
      "state": "dead",
      "finding": {
        "code": "DS1801",
        "kind": "unused-schema-type",
        "language": "proto",
        "position": {
          "path": "proto/b/v1/service.proto",
          "line": 5,
          "column": 3,
          "end_line": 5
        },
        "symbol": {
          "ref": "proto://v1#Ping",
          "kind": "message",
          "name": "Ping",
          "parent": "proto://v1#",
          "exported": true,
          "size_lines": 1
        },
        "reachability_class": "probable",
        "confidence": "probable",
        "liveness_relation": "reference-counting",
        "test_only": false,
        "generated": false,
        "component": {
          "id": "deadset-proto/c-2",
          "root": true,
          "symbol_count": 1,
          "deletable_lines": 1
        },
        "retained_by": [],
        "configurations": [],
        "consumers_loaded": [],
        "fixability": "deletable",
        "severity": "deny",
        "message": "schema type is used by no binding in any analyzed language",
        "details": {}
      },
      "uses": [],
      "members": []
    }
  ]
}
