{
  "facts_version": "1.0.0",
  "analyzer": {
    "name": "deadset-go",
    "version": "2.0.0"
  },
  "language": "go",
  "evaluated": true,
  "generated": [
    {
      "path": "gen/go/v1/service.pb.go",
      "line": 1,
      "evidence": "header",
      "detail": "// Code generated by protoc-gen-go. DO NOT EDIT.",
      "generator": {
        "row": "protoc-gen-go-1",
        "version": "v1.36.11"
      },
      "schema_files": [
        "v1/service.proto"
      ]
    }
  ],
  "bindings": [
    {
      "role": "consumer",
      "symbol": "go://example.com/app/gen/go/v1#PingRequest.Number",
      "schema_file": "v1/service.proto",
      "schema": "proto://v1#PingRequest.number",
      "generated_file": "gen/go/v1/service.pb.go",
      "state": "unreferenced"
    }
  ]
}
