{
  "facts_version": "1.0.0",
  "analyzer": {
    "name": "deadset-ts",
    "version": "2.0.0"
  },
  "language": "ts",
  "evaluated": true,
  "generated": [
    {
      "path": "web/src/gen/v1/types.ts",
      "line": 1,
      "evidence": "header",
      "detail": "// Code generated by protoc-gen-ts_proto. DO NOT EDIT.",
      "generator": {
        "row": "ts-proto-2-types",
        "version": "v2.11.4"
      },
      "schema_files": [
        "v1/service.proto"
      ]
    }
  ],
  "bindings": [
    {
      "role": "fallback",
      "symbol": "ts://@example/web/src/gen/v1/types.ts#",
      "schema_file": "v1/service.proto",
      "generated_file": "web/src/gen/v1/types.ts",
      "scope": "types",
      "state": "live"
    }
  ]
}
