{
  "facts_version": "1.0.0",
  "analyzer": {
    "name": "deadset-ts",
    "version": "2.0.0"
  },
  "language": "ts",
  "evaluated": true,
  "generated": [
    {
      "path": "web/src/gen/v1/service_pb.ts",
      "line": 1,
      "evidence": "tag",
      "detail": "// @generated by protoc-gen-es v2.12.0 with parameter \"target=ts\"",
      "generator": {
        "row": "protoc-gen-es-2",
        "version": "v2.12.0"
      },
      "schema_files": [
        "v1/service.proto"
      ]
    }
  ],
  "bindings": [
    {
      "role": "consumer",
      "symbol": "ts://@example/web/src/gen/v1/service_pb.ts#Ping",
      "schema_file": "b/v1/service.proto",
      "schema": "proto://v1#Ping",
      "generated_file": "web/src/gen/v1/service_pb.ts",
      "state": "unreferenced"
    }
  ]
}
